{
  "id": "php-secrets-001",
  "title": "Mailer API key hardcoded in committed configuration",
  "language": "php",
  "ecosystem": "php",
  "category": "secrets",
  "difficulty": "easy",
  "source_type": "synthetic",
  "source_url": null,
  "description": "An environment lookup for the mailer API key is replaced by a literal value committed to the repository.",
  "context": "config/services.php is tracked in version control and deployed to all environments. The repository has no secret-scanning hook.",
  "diff": "diff --git a/config/services.php b/config/services.php\n--- a/config/services.php\n+++ b/config/services.php\n@@ -8,9 +8,9 @@ return [\n\n     'mailer' => [\n         'endpoint' => 'https://api.mailer.example/v1',\n-        'api_key'  => getenv('WFB_MAILER_API_KEY') ?: '',\n+        'api_key'  => 'wfb_live_EXAMPLE_NOT_A_REAL_KEY_2f9c1d',\n         'timeout'  => 10,\n     ],\n ];\n",
  "expected_findings": [
    {
      "id": "php-secrets-001-f1",
      "category": "secrets",
      "defect_type": "hardcoded_secret",
      "severity": "high",
      "file": "config/services.php",
      "description": "A mailer API key literal is committed to the repository instead of being read from the environment."
    }
  ],
  "is_clean": false,
  "label_source": "human_reviewed",
  "label_status": "frozen",
  "reviewed_by": ["Oleksii Siniaiev"],
  "academic_review": false,
  "tags": [
    "credentials",
    "configuration"
  ],
  "notes": "The literal in this case is a fabricated placeholder, not a real credential. It is deliberately shaped like a key so that secret-detection behaviour can be measured.",
  "references": []
}
