{
  "id": "laravel-clean-001",
  "title": "Invoice status update refactored to a single fill()/save()",
  "language": "php",
  "ecosystem": "laravel",
  "category": "clean_control",
  "difficulty": "easy",
  "source_type": "synthetic",
  "source_url": null,
  "description": "Three attribute assignments are collapsed into fill()/save(). Behaviour, authorisation and validation are unchanged.",
  "context": "Invoice::$fillable includes both status and paid_at, so fill() will not silently discard either value. The authorize() call and InvoicePolicy are unchanged and visible as context lines in the diff.",
  "diff": "diff --git a/app/Http/Controllers/InvoiceController.php b/app/Http/Controllers/InvoiceController.php\n--- a/app/Http/Controllers/InvoiceController.php\n+++ b/app/Http/Controllers/InvoiceController.php\n@@ -40,13 +40,15 @@ class InvoiceController extends Controller\n\n     public function markPaid(MarkInvoicePaidRequest $request, Invoice $invoice): RedirectResponse\n     {\n         $this->authorize('markPaid', $invoice);\n\n-        $invoice->status = 'paid';\n-        $invoice->paid_at = now();\n-        $invoice->save();\n+        $invoice->fill([\n+            'status'  => 'paid',\n+            'paid_at' => now(),\n+        ]);\n+\n+        $invoice->save();\n\n         return back()->with('status', 'Invoice marked as paid.');\n     }\n",
  "expected_findings": [],
  "is_clean": true,
  "label_source": "human_reviewed",
  "label_status": "frozen",
  "reviewed_by": ["Oleksii Siniaiev"],
  "academic_review": false,
  "tags": [
    "refactor",
    "control"
  ],
  "notes": "Clean control. 'status' and 'paid_at' are on the model's $fillable list and the values are literals, so fill() introduces no mass-assignment exposure. Any finding reported here counts as a false positive.",
  "references": []
}
