{
  "id": "wp-xss-001",
  "title": "Search term echoed into a template without escaping",
  "language": "php",
  "ecosystem": "wordpress",
  "category": "xss",
  "difficulty": "easy",
  "source_type": "synthetic",
  "source_url": null,
  "description": "A template stops using esc_html() and concatenates the raw query-string parameter into the echoed markup.",
  "context": "$_GET['wfb_q'] is attacker-controllable via a crafted link. The template is rendered on a public page and no output buffering filter escapes it later.",
  "diff": "diff --git a/wp-content/plugins/wfb-demo/templates/search-results.php b/wp-content/plugins/wfb-demo/templates/search-results.php\n--- a/wp-content/plugins/wfb-demo/templates/search-results.php\n+++ b/wp-content/plugins/wfb-demo/templates/search-results.php\n@@ -1,9 +1,9 @@\n <div class=\"wfb-search-results\">\n-    <p class=\"wfb-query\">You searched for: <?php echo esc_html( $query ); ?></p>\n+    <p class=\"wfb-query\">You searched for: <?php echo '<strong>' . $_GET['wfb_q'] . '</strong>'; ?></p>\n\n     <ul>\n         <?php foreach ( $results as $result ) : ?>\n             <li><?php echo esc_html( $result->title ); ?></li>\n         <?php endforeach; ?>\n     </ul>\n </div>\n",
  "expected_findings": [
    {
      "id": "wp-xss-001-f1",
      "category": "xss",
      "defect_type": "xss_unescaped_output",
      "severity": "high",
      "file": "wp-content/plugins/wfb-demo/templates/search-results.php",
      "description": "The query-string parameter wfb_q is echoed without escaping, producing reflected cross-site scripting."
    }
  ],
  "is_clean": false,
  "label_source": "human_reviewed",
  "label_status": "frozen",
  "reviewed_by": ["Oleksii Siniaiev"],
  "academic_review": false,
  "tags": [
    "reflected-xss",
    "escaping",
    "template"
  ],
  "notes": null,
  "references": []
}
